,Organisation Name,OrgUrls,Desc,Technologies,Topic,Organisation site,number of Projects
98, Unikraft ,https://summerofcode.withgoogle.com//programs/2023/organizations/unikraft,A Fast and Secure Unikernel SDK,"c, xen, golang, kvm, assembly language","virtualization, cloud, software reuse, software configurability",https://unikraft.org/,4
99, Wagtail ,https://summerofcode.withgoogle.com//programs/2023/organizations/wagtail,The powerful Python CMS for modern websites,"python, javascript, django","web, accessibility, cms",https://wagtail.org/,2
100, libcamera ,https://summerofcode.withgoogle.com//programs/2023/organizations/libcamera,Provide an open source camera stack for linux,"c/c++, linux kernel, qt5, gstreamer, v4l2","camera, image prcessing",https://libcamera.org,2
101, AboutCode ,https://summerofcode.withgoogle.com//programs/2023/organizations/aboutcode,"Scan code for origin, license and vulnerabilities","python, javascript, Django+PostgreSQL, C/Rust/Go","dependencies, vulnerabilities, SoftwareCompositionAnalysis, License, SBOM",https://aboutcode.org,2
102, The Julia Language ,https://summerofcode.withgoogle.com//programs/2023/organizations/the-julia-language,A fresh approach to technical computing,"machine learning, julia, data science, compilers, garbage-collection","math, machine learning, science, data science, graphs",https://julialang.org,14
103, Open Chemistry ,https://summerofcode.withgoogle.com//programs/2023/organizations/open-chemistry,Advancing Open Source & Open Science for Chemistry,"python, javascript, opengl, c++, c++14","data science, graphics, scientific visualization, cheminformatics, quantum chemistry",https://openchemistry.org/,8
104, 52°North Spatial Information Research GmbH ,https://summerofcode.withgoogle.com//programs/2023/organizations/52north-spatial-information-research-gmbh,Innovative ideas & technologies in geoinformatics,"javascript, android, java, web services, ogc standards","citizen science, spatial information infrastructures, open standards, data analytics, Geoinformation",https://52north.org/,3
105, GNU Project ,https://summerofcode.withgoogle.com//programs/2023/organizations/gnu-project,Development of the GNU Operating System,"c, c++, gcc, autotools","tools, toolchain, command line, OS, binary tools",https://www.gnu.org,7
106, MDAnalysis ,https://summerofcode.withgoogle.com//programs/2023/organizations/mdanalysis,Analysis of molecular simulations data with Python,"python, cython, c/c++","science, computational-chemistry, high-performance-computing, molecular-simulation, soft-matter-physics",https://www.mdanalysis.org,2
107, OpenAstronomy ,https://summerofcode.withgoogle.com//programs/2023/organizations/openastronomy,Look at the Universe with the power of open source,"c, python, julia","image processing, astronomy, solar physics, high energy astrophysics",https://openastronomy.org/,6
108, OpenVINO Toolkit ,https://summerofcode.withgoogle.com//programs/2023/organizations/openvino-toolkit,Make AI inference faster and easier to deploy!,"python, c++, x86","ai, deep learning, neural network, inference, gen ai",https://docs.openvino.ai/,5
109, openSUSE Project ,https://summerofcode.withgoogle.com//programs/2023/organizations/opensuse-project,"Makers' choice for sysadmins, developers & users","python, c/c++, go, ruby, reactjs javascript","AIML, operating system developer tools, containers kubernetes, Security Cryptography, systems management",https://get.opensuse.org/,8
110, OpenCV ,https://summerofcode.withgoogle.com//programs/2023/organizations/opencv,#NAME?,"python, c++, deep learning, ai","robotics, computer vision, ai, deep learning",https://opencv.org/,10
111, Internet Health Report ,https://summerofcode.withgoogle.com//programs/2023/organizations/internet-health-report,Monitoring the Internet,"python, javascript, apache kafka, VueJS","networking, routing, communication, internet, data analytics",https://ihr.iijlab.net,4
112, Ceph ,https://summerofcode.withgoogle.com//programs/2023/organizations/ceph,The Future of Storage,"python, javascript, c++","distributed systems, Software-Defined-Storage",https://ceph.io/en/,3
113, Ivy (lets-unify.ai) ,https://summerofcode.withgoogle.com//programs/2023/organizations/ivy-lets-unifyai,The Unified AI Framework,"python, cython, tensorflow, pytorch, Jax","machine learning, artificial intelligence, computation graph, code conversion, unified API",https://unify.ai,3
114, Machine Learning for Science (ML4SCI) ,https://summerofcode.withgoogle.com//programs/2023/organizations/machine-learning-for-science-ml4sci,Machine learning applications in science,"python, machine learning, c++, data analysis, artificial intelligence","machine learning, science and medicine, algorithms, physics, astronomy",https://ml4sci.org/,23
115, CERN-HSF ,https://summerofcode.withgoogle.com//programs/2023/organizations/cern-hsf,Umbrella for Particle Physics-related projects,"python, c/c++, data analysis, artificial intelligence, container orchestration","machine learning, big data, algorithmics, particle physics, Performance Optimisation",http://hepsoftwarefoundation.org/activities/gsoc.html,16
116, Cockpit Project ,https://summerofcode.withgoogle.com//programs/2023/organizations/cockpit-project,Cockpit is an interactive server admin interface,"python, javascript, react","operating systems, web, linux",https://cockpit-project.org/,2
117, Dart ,https://summerofcode.withgoogle.com//programs/2023/organizations/dart,Dart is a client language for apps on any platform,"flutter, dart","programming languages, mobile apps",https://dart.dev,2
118, MariaDB ,https://summerofcode.withgoogle.com//programs/2023/organizations/mariadb,The fastest growing Open Source Database,"python, javascript, c/c++, perl, databases","Database Engines, SQL Features",https://mariadb.org,5
119, OSGeo (Open Source Geospatial Foundation) ,https://summerofcode.withgoogle.com//programs/2023/organizations/osgeo-open-source-geospatial-foundation,The Open Source Geospatial Foundation,"c, python, javascript, java, c++","open science, gis, citizen science, geolocation, mapping",https://www.osgeo.org/,7
120, Eclipse Foundation ,https://summerofcode.withgoogle.com//programs/2023/organizations/eclipse-foundation,The Global Open Source Foundation,"java, rtos, deeplearning, eclipsejavaide, jakartaee","robotics, automotive, tools, cloud native java, iot & edge",https://www.eclipse.org/,6
121, MoveIt ,https://summerofcode.withgoogle.com//programs/2023/organizations/moveit,Moving robots into the future,"python, ros, c++, rust","robotics, motion planning, trajectory generation, kinematics",https://moveit.ros.org,2
122, The JPF team ,https://summerofcode.withgoogle.com//programs/2023/organizations/the-jpf-team,JPF is a special JVM for software verification,"android, java, distributed systems, jvm, smt solvers","model checking, symbolic execution, verification of concurrent systems, program analysis, test input generation",https://github.com/javapathfinder/jpf-core/wiki,2
123, FOSSology ,https://summerofcode.withgoogle.com//programs/2023/organizations/fossology,Open Source License Compliance by OSS,"python, postgresql, c/c++, go, php","automation, spdx, license compliance, nlp, compliance automation",https://fossology.org,5
124, AOSSIE ,https://summerofcode.withgoogle.com//programs/2023/organizations/aossie,Australian Umbrella Org for Open-Source Projects,"python, javascript, android, flutter, Blockchain","web, machine learning, natural language processing, mobile, backend",https://www.aossie.org,6
125, Processing Foundation ,https://summerofcode.withgoogle.com//programs/2023/organizations/processing-foundation,To empower all people to learn to program,"python, javascript, android, java, opengl","education, web, graphics, creative coding, design",http://processingfoundation.org,8
126, Open Robotics ,https://summerofcode.withgoogle.com//programs/2023/organizations/open-robotics,Open source software for robotics,"ros, gazebo, ignition, Open-RMF","robotics, simulation, fleet management",https://www.openrobotics.org/,3
127, SymPy ,https://summerofcode.withgoogle.com//programs/2023/organizations/sympy,SymPy is a Python library for symbolic mathematics,"python, numpy, jupyter","mathematics, physics, symbolic mathematics",https://www.sympy.org/,5
128, Purr Data ,https://summerofcode.withgoogle.com//programs/2023/organizations/purr-data,Realtime Audio/Visual Programming Environment,"c, javascript, html5, Emscripten","web, graphics, audio, realtime",https://www.purrdata.net/,2
129, SCoRe Lab ,https://summerofcode.withgoogle.com//programs/2023/organizations/score-lab,SCORE Lab develops FOSS softwares for everyone!!!,"python, java, go, nodejs, reactjs","security, machine learning, cloud, ai",https://scorelab.org/,12
130, FreeType ,https://summerofcode.withgoogle.com//programs/2023/organizations/freetype,FreeType is a software library to render fonts.,"c, autotools, meson","library, rendering, fonts, opentype, truetype",https://freetype.org,3
131, ArduPilot ,https://summerofcode.withgoogle.com//programs/2023/organizations/ardupilot,World's most advanced autonomous vehicle software,"python, lua, c++, pixhawk","robotics, Drone, autonomous vehicle, UGV, unmanned vehicle",https://ardupilot.org/,4
132, International Catrobat Association ,https://summerofcode.withgoogle.com//programs/2023/organizations/international-catrobat-association,Free visual coding apps for computational thinking,"javascript, swift, kotlin, php, flutter","education, visual programming, mobile programming, game engines, creativity tools",https://www.catrobat.org,7
133, GRAME ,https://summerofcode.withgoogle.com//programs/2023/organizations/grame,Domain specific language for audio,"c, python, javascript, c++, typescript","audio, compiler, digital signal processing, function programming language",https://faust.grame.fr,2
134, Keploy ,https://summerofcode.withgoogle.com//programs/2023/organizations/keploy,E2E test generation and mocking toolkit,"c, golang, node, MERN, epbf","API Testing, No code platform, Dev Tool, Functional Testing, Mock and Stubs Generation",https://keploy.io,2
135, Ruby ,https://summerofcode.withgoogle.com//programs/2023/organizations/ruby,Ruby is an object-oriented programming language,"c, java, ruby on rails, ruby, rubygems","security, web, cloud, server, application",https://www.ruby-lang.org/,4
136, Plone Foundation ,https://summerofcode.withgoogle.com//programs/2023/organizations/plone-foundation,"Python-based CMS, with React front-end.","python, javascript, react","web, cms",https://plone.org,5
137, Genome Assembly and Annotation ,https://summerofcode.withgoogle.com//programs/2023/organizations/genome-assembly-and-annotation,Providing freely accessible genomic data,"python, mysql, docker, pytorch, nextflow","machine learning, genomics, big data, cloud, hpc",https://www.ebi.ac.uk/,5
138, Postman ,https://summerofcode.withgoogle.com//programs/2023/organizations/postman,The Future is API-First,"javascript, api, openapi, AsyncAPI, JSON Schema","testing, api, automation, documentation, data",https://postman.com,8
139, Organic Maps ,https://summerofcode.withgoogle.com//programs/2023/organizations/organic-maps,"Offline maps app for tourists, cyclers & hikers","android, java, c++, ios, OpenStreetMap","privacy, maps, navigation, mobile, offline",https://organicmaps.app,3
140, Gentoo Foundation ,https://summerofcode.withgoogle.com//programs/2023/organizations/gentoo-foundation,"A flexible, source-based Linux distribution.","c, python, shell, linux, bash","operating systems, security, embedded, init, package",https://www.gentoo.org/,3
141, GnuTLS ,https://summerofcode.withgoogle.com//programs/2023/organizations/gnutls,C library implementing TLS and DTLS,"c, Cryptography, TLS","security, cryptography, TLS, DTLS",https://gitlab.com/gnutls/gnutls,2
142, CGAL Project ,https://summerofcode.withgoogle.com//programs/2023/organizations/cgal-project,C++ library of computational geometry,"c++, qt","geometry, mesh processing, computation geometry, geometry processing",https://www.cgal.org,10
143, Wikimedia Foundation ,https://summerofcode.withgoogle.com//programs/2023/organizations/wikimedia-foundation,Brings free educational content to the world,"python, javascript, html, php, css","semantic web, wikipedia, wikimedia, mediawiki, i18n",http://wikimediafoundation.org/,9
144, FLARE ,https://summerofcode.withgoogle.com//programs/2023/organizations/flare,Industry leading malware analysis,"python, ida-pro, Ghidra","emulation, disassembly, decompilation, malware-analysis, reverse-engineering",https://www.mandiant.com/,4
145, OpenStreetMap ,https://summerofcode.withgoogle.com//programs/2023/organizations/openstreetmap,Create and distribute free geodata for the world,"javascript, java, c++","databases, web, routing, ui, geodata",https://www.openstreetmap.org/,4
146, RTEMS Project ,https://summerofcode.withgoogle.com//programs/2023/organizations/rtems-project,A real-time operating system for Earth & Space,"python, c/c++, assembly, posix","kernel, embedded, real-time, multicore, rtos",https://www.rtems.org/,3
147, National Resource for Network Biology (NRNB) ,https://summerofcode.withgoogle.com//programs/2023/organizations/national-resource-for-network-biology-nrnb,Developing open source tools for network biology,"python, javascript, java, html, r","web application, data science, graphics, scientific computing, network biology",https://nrnb.org/gsoc.html,8
148, Mayor's Office of New Urban Mechanics ,https://summerofcode.withgoogle.com//programs/2023/organizations/mayors-office-of-new-urban-mechanics,Exploring new approaches to civic life.,"python, javascript, ruby, tensorflow","web, machine learning, gis, civic tech, analytics",https://www.boston.gov/departments/innovation-and-technology,4
149, MetaCall ,https://summerofcode.withgoogle.com//programs/2023/organizations/metacall,Simplifying the embedding of programming languages,"python, c++, rust, nodejs, docker","cloud, polyglot, faas, languages, ffi",https://metacall.io,4
150, Ste||ar group ,https://summerofcode.withgoogle.com//programs/2023/organizations/stear-group,Shaping a Scalable Future,"c++, hpc","library, optimization, parallel algorithms, hpx, application",http://stellar-group.org/,5
151, Micro Electronics Research Lab - UITU ,https://summerofcode.withgoogle.com//programs/2023/organizations/micro-electronics-research-lab-uitu,Accelerating Engineering Innovation,"RISCV, Processor, Hardware, systemonchip, memory","iot, embedded, Processor, System on Chip, RISC-V",https://www.merledupk.org,1
152, KubeVirt ,https://summerofcode.withgoogle.com//programs/2023/organizations/kubevirt,Building a virtualization API for Kubernetes,"golang, grpc","virtualization, containers, kubernetes",https://kubevirt.io,1
153, Zulip ,https://summerofcode.withgoogle.com//programs/2023/organizations/zulip,Organized team chat app designed for efficiency.,"python, django, flutter, css, typescript","great developer tooling, visual design, teaching quality codebase, team chat, integrations",https://zulip.com/,13
154, CRIU ,https://summerofcode.withgoogle.com//programs/2023/organizations/criu,Chekpoint/Restore for Linux tasks and containers,"c, python, linux, go","cloud, containers, Checkpoint/Restore",https://criu.org,3
155, Blender Foundation ,https://summerofcode.withgoogle.com//programs/2023/organizations/blender-foundation,The Freedom to Create,"c, python, opengl, c++, vulkan","games, graphics, 3d, rendering, animation",https://www.blender.org,5
156, Red Hen Lab ,https://summerofcode.withgoogle.com//programs/2023/organizations/red-hen-lab,Research on Multimodal Communication,"python, machine learning, nlp, ai, data science","data science, ai, language, multimodal communication, gesture",http://www.redhenlab.org,5
157, BeagleBoard.org ,https://summerofcode.withgoogle.com//programs/2023/organizations/beagleboardorg,Open hardware computing for educators and makers,"linux, fpga, risc-v, dsp, Zephyr RTOS","robotics, iot, ai, software defined radio, Personal Server",https://www.beagleboard.org,4
158, SPDX ,https://summerofcode.withgoogle.com//programs/2023/organizations/spdx,An open ISO standard for SBOMs,"python, java, json, go, rdf","compliance, licensing, data, vulnerabilities",https://spdx.dev,3
159, Metasploit ,https://summerofcode.withgoogle.com//programs/2023/organizations/metasploit,World’s most used penetration testing framework,"c, python, postgresql, ruby, assembly","security, penetration testing, offensive security, exploitation",https://metasploit.com,1
160, Mathesar ,https://summerofcode.withgoogle.com//programs/2023/organizations/mathesar,Webapp providing a UX-first interface to databases,"python, postgresql, javascript, django, svelte","databases, web, data, nonprofit, self-hosted",https://mathesar.org/,2
161, The Honeynet Project ,https://summerofcode.withgoogle.com//programs/2023/organizations/the-honeynet-project,Honeypots and Threat Intelligence R&D,"python, javascript, django, go, docker","honeypots, malware analysis, Threat Intelligence",https://honeynet.org,6
162, Free and Open Source Silicon Foundation ,https://summerofcode.withgoogle.com//programs/2023/organizations/free-and-open-source-silicon-foundation,Working together for Free and Open Source Silicon,"verilog, risc-v, compiler, web development","hardware, debug, web services, simulation, electronic design tools",https://www.fossi-foundation.org,5
163, Chromium ,https://summerofcode.withgoogle.com//programs/2023/organizations/chromium-lj,"Fast, seamless, safe, and reliable web for all","python, javascript, java, c++, git","web, browser, operating-system",https://chromium.org,17
164, MZmine and MS-DIAL ,https://summerofcode.withgoogle.com//programs/2023/organizations/mzmine-and-ms-dial,Open-source software for mass spectrometry,"java, c#, javafx","data science, graphics, cheminformatics, mass spectrometry, feature detection",https://mzmine-ms-dial-gsoc.github.io/,2
165, Kotlin Foundation ,https://summerofcode.withgoogle.com//programs/2023/organizations/kotlin-foundation,Advance the Kotlin programming language,"gradle, kotlin, jvm, Parsers & Compilers, Multiplatform","compilers, programming languages, software development, libraries, Programming & Build Tools",https://kotlinfoundation.org/,4
166, Open Technologies Alliance - GFOSS ,https://summerofcode.withgoogle.com//programs/2023/organizations/open-technologies-alliance-gfoss,Promote Open Standards and Open Source,"javascript, c/c++, nodejs, python 3, Machine Learning (ML)","web, robotics, open hardware, c++, Artificial Inteligence",http://www.gfoss.eu,7
167, SageMath ,https://summerofcode.withgoogle.com//programs/2023/organizations/sagemath,Open-source mathematics software system,"python, cython","mathematics, education, research",https://www.sagemath.org,6
