,Organisation Name,OrgUrls,Desc,Technologies,Topic,Organisation site,number of Projects
0, Software and Computational Systems Lab at LMU Munich ,https://summerofcode.withgoogle.com//programs/2023/organizations/software-and-computational-systems-lab-at-lmu-munich,"Software Verification, SAT & SMT solving","python, java","software verification, benchmarking, program analysis, formal methods, SAT & SMT solving",https://www.sosy-lab.org/,4
1, Pharo Consortium ,https://summerofcode.withgoogle.com//programs/2023/organizations/pharo-consortium,Modern and innovative programming language,"git, smalltalk, pharo, spec, SUnit","machine learning, programming languages, ai, virtual machines, Modelling",https://pharo.org/,6
2, checkstyle ,https://summerofcode.withgoogle.com//programs/2023/organizations/checkstyle,Helps to adheres of Java coding standard,"java, antlr","static code analysis, code review tool, coding standards, coding conventions",https://checkstyle.org,2
3, Scalable Parallel Computing Laboratory ,https://summerofcode.withgoogle.com//programs/2023/organizations/scalable-parallel-computing-laboratory,High-performance computing for clusters and clouds,"python, c++, mpi, aws, Serverless","programming languages, high-performance computing, parallel computing, Serverless Computing, faas",https://spcl.inf.ethz.ch/,2
4, omegaUp ,https://summerofcode.withgoogle.com//programs/2023/organizations/omegaup,Open CS Education as a catalyst for social change,"python, mysql, php, typescript, vue.js","education, web, cloud, edtech, UX/UI",https://omegaup.org,3
5, mlpack ,https://summerofcode.withgoogle.com//programs/2023/organizations/mlpack,"a fast, flexible machine learning library","c++, C++ template metaprogramming","machine learning, embedded, ai, deep learning, Neural networks",https://www.mlpack.org,3
6, CHIPS Alliance ,https://summerofcode.withgoogle.com//programs/2023/organizations/chips-alliance,"Open source IP, tools & standards for ASIC/FPGA","fpga, chisel, risc-v, systemverilog, ASIC","soc, IP cores, ASIC design, HDL, chiplets",https://chipsalliance.org/,4
7, Haiku ,https://summerofcode.withgoogle.com//programs/2023/organizations/haiku,Operating system that targets personal computing.,"c++, posix, unix","desktop, kernel, network, media, gui",https://www.haiku-os.org,3
8, Scala Center ,https://summerofcode.withgoogle.com//programs/2023/organizations/scala-center,Guide and support the Scala community,"scala, scala.js, scala native","education, compilers, tooling",https://scala-lang.org/,6
9, cBioPortal for Cancer Genomics ,https://summerofcode.withgoogle.com//programs/2023/organizations/cbioportal-for-cancer-genomics,Aid discovery in complex cancer genomics data,"mysql, javascript, java, react, typescript","genomics, cancer, bioinformatics, big data, precision medicine",https://www.cbioportal.org/,6
10, AFLplusplus ,https://summerofcode.withgoogle.com//programs/2023/organizations/aflplusplus,State of the art fuzzing for better security,"llvm, rust, fuzzing, qemu","fuzzing, ci",https://aflplus.plus,2
11, The Linux Foundation ,https://summerofcode.withgoogle.com//programs/2023/organizations/the-linux-foundation,Non-profit consortium fostering growth of Linux,"c, linux, c++, cups, ipp","kernel, automotive, printing, iio, zephyr",http://www.linuxfoundation.org/,10
12, Qdrant ,https://summerofcode.withgoogle.com//programs/2023/organizations/qdrant,Vector Search Database for the new AI generation.,"python, javascript, rust","databases, machine learning, Search Engines",https://qdrant.tech,2
13," Stratosphere Laboratory, Czech Technical University in Prague ",https://summerofcode.withgoogle.com//programs/2023/organizations/stratosphere-laboratory-czech-technical-university-in-prague,Using machine learning and security to help others,"python, redis, docker, textual","machine learning, network security, civil society, Security Defense",https://www.stratosphereips.org/,1
14, PEcAn Project ,https://summerofcode.withgoogle.com//programs/2023/organizations/pecan-project,Develop and promote tools for ecosystem modeling,"r, docker, api, geospatial","data science, ecosystem models, scientific visualization, climate science, Ecological Forecasting,",https://pecanproject.github.io/,4
15, Internet Archive ,https://summerofcode.withgoogle.com//programs/2023/organizations/internet-archive,Universal Access to All Knowledge,"python, javascript, go, elasticsearch, hadoop","library, media, archiving",http://archive.org,5
16, CNCF ,https://summerofcode.withgoogle.com//programs/2023/organizations/cncf,Building sustainable ecosystems for cloud native,"prometheus, kubernetes, OpenTelemetry, envoy","cloud, cloud native, observability",https://cncf.io,14
17, Invesalius ,https://summerofcode.withgoogle.com//programs/2023/organizations/invesalius,3D Medical visualization and neuronavigation tool,"python, cython, numpy, dicom, Vtk","ehealth, medical imaging, 3D Reconstruction, 3d printing, Neuronavigation",https://invesalius.github.io/,2
18, PostgreSQL ,https://summerofcode.withgoogle.com//programs/2023/organizations/postgresql,The Most Advanced Open Source Relational Database,"c, python, postgresql, javascript, go","web, database, ui, sql, Benchmark",https://postgresql.org,12
19, Apertium ,https://summerofcode.withgoogle.com//programs/2023/organizations/apertium,A free/open-source machine translation platform,"python, javascript, c++, xml, bash","natural language processing, machine translation, language technology, less-resources languages",https://apertium.org/,5
20, Jenkins ,https://summerofcode.withgoogle.com//programs/2023/organizations/jenkins-wp,"Jenkins, build great things at any scale","javascript, java, go, docker, kubernetes","developer tools, automation, continuous integration, continuous delivery, devops",https://jenkins.io/,4
21," Department of Biomedical Informatics, Emory University ",https://summerofcode.withgoogle.com//programs/2023/organizations/department-of-biomedical-informatics-emory-university,Biomedical research to advance healthcare,"python, javascript, java, dicom, Colab","science and medicine, data integration, workflows, radiology, ML/AL",https://med.emory.edu/departments/biomedical-informatics/,5
22, OpenMRS ,https://summerofcode.withgoogle.com//programs/2023/organizations/openmrs,"Write Code, Save Lives.","mysql, javascript, java, reactjs, fhir","platform, frontend, Electronic Medical Record System, QA automation",https://openmrs.org/,9
23, Carbon Language ,https://summerofcode.withgoogle.com//programs/2023/organizations/carbon-language,An experimental successor to C++,"llvm, c++, clang, Bison","programming languages, c++",https://github.com/carbon-language/carbon-lang,2
24, The FreeBSD Project ,https://summerofcode.withgoogle.com//programs/2023/organizations/the-freebsd-project,An OS for servers to embedded devices,"c, llvm, assembly, make, POSIX shell","virtualization, operating system, Embedded System",https://www.freebsd.org/,6
25, Pitivi ,https://summerofcode.withgoogle.com//programs/2023/organizations/pitivi,Self-expression through filmmaking,"c, python, gtk, gstreamer","video processing, filmmaking, video editing",https://www.pitivi.org/,2
26, INCF ,https://summerofcode.withgoogle.com//programs/2023/organizations/incf,An open & FAIR neuroscience standards organization,"python, javascript, java, c++, gpu","machine learning, data visualization, neuroscience, brain modelling, neuroimage processing",https://www.incf.org,22
27, ScummVM ,https://summerofcode.withgoogle.com//programs/2023/organizations/scummvm,Adventure and RPG preservation project,"python, opengl, c++, assembly, php","games, game engines, software preservation, software archeology",https://www.scummvm.org/,4
28, Jina AI ,https://summerofcode.withgoogle.com//programs/2023/organizations/jina-ai-sb,"Multimodal AI from the community, for everyone","python, machine learning, microservices, data science, Multimodel AI","cloud native, neural search, generative AI, Python MLOps Framework, Mulitmodel Data",https://jina.ai/,1
29, KDE Community ,https://summerofcode.withgoogle.com//programs/2023/organizations/kde-community,International team developing Open Source software,"c++, qt, qml, data structures","education, science, applications, desktop environment",https://kde.org/,7
30, VideoLAN ,https://summerofcode.withgoogle.com//programs/2023/organizations/videolan,Open Source Multimedia for everyone!,"c, c++, qt, assembly, video","audio, streaming, video, codecs, media database",https://www.videolan.org,10
31, Apache Software Foundation ,https://summerofcode.withgoogle.com//programs/2023/organizations/apache-software-foundation,Open source software to the public free of charge,"c, java, c++","big data, cloud, libraries, other",https://apache.org,25
32, FFmpeg ,https://summerofcode.withgoogle.com//programs/2023/organizations/ffmpeg,"Record, convert and stream audio & video","c, git, asm","audio, video, subtitles, multimedia",https://ffmpeg.org/,3
33, CircuitVerse.org ,https://summerofcode.withgoogle.com//programs/2023/organizations/circuitverseorg,Build and learn logic circuits in the cloud!,"javascript, rails, canvas, vue","education, web, simulation, pedagogy, digital logic design",http://circuitverse.org/,4
34, JdeRobot ,https://summerofcode.withgoogle.com//programs/2023/organizations/jderobot,Toolkit for developing Robotics applications,"python, ros, gazebo, opencv, tensorflow","education, artificial intelligence, robotics, computer vision, developer tools",http://jderobot.github.io,4
35, LibreOffice ,https://summerofcode.withgoogle.com//programs/2023/organizations/libreoffice,LibreOffice is a free and open source office suite,"python, java, c++","office suite, desktop application, end user application",https://www.libreoffice.org/,5
36, The ENIGMA Team ,https://summerofcode.withgoogle.com//programs/2023/organizations/the-enigma-team,A free rapid game development environment.,"opengl, c++, qt5, recursive-descent","graphics, game development, compiler, programming, game design",https://enigma-dev.org,2
37, The Tor Project ,https://summerofcode.withgoogle.com//programs/2023/organizations/the-tor-project,Defend yourself against tracking and surveillance.,"c, python, web, rust","security, privacy, anti-censorship, Human Rights, Surveillance",https://www.torproject.org/,4
38, XMPP Standards Foundation ,https://summerofcode.withgoogle.com//programs/2023/organizations/xmpp-standards-foundation,XSF develops an open-standard messaging protocol,"gtk, vala, xmpp, swift, Objective C","instant messaging, chat, WebRTC, Jingle, Real-Time Communication",https://xmpp.org/,2
39, GeomScale ,https://summerofcode.withgoogle.com//programs/2023/organizations/geomscale,Scalable geometric and statistical software,"python, c++, r, jupyter, github-actions","mathematics, data science, computational biology, computational geometry, statistics",https://geomscale.github.io,3
40, MuseScore ,https://summerofcode.withgoogle.com//programs/2023/organizations/musescore,The World’s Most Popular Music Notation Software,"c++, qt, qml, cmake","music, midi, musicxml, sheet music, music notation",https://musescore.org/,1
41, GNU Image Manipulation Program ,https://summerofcode.withgoogle.com//programs/2023/organizations/gnu-image-manipulation-program,GIMP is a cross-platform image editor,"c, GEGL","graphics, design, photography, illustration",https://www.gimp.org/,3
42, Rizin ,https://summerofcode.withgoogle.com//programs/2023/organizations/rizin,Rizin reverse engineering framework and toolset,"c, python, go, c++, qt","reverse engineering, computer security, debugging, emulation, disassembly",https://rizin.re,1
43, CCExtractor Development ,https://summerofcode.withgoogle.com//programs/2023/organizations/ccextractor-development,"TV, Rust, Flutter, Linux, VR and C. In any order.","c, linux, rust, flutter","vr, linux, video, subtitles, mobile",https://www.ccextractor.org,7
44, coreboot ,https://summerofcode.withgoogle.com//programs/2023/organizations/coreboot,"Fast, secure and flexible BIOS firmware","c, assembly, arm, x86","hardware, drivers, firmware, boot loader, BIOS",https://coreboot.org,1
45, rocket.chat ,https://summerofcode.withgoogle.com//programs/2023/organizations/rocketchat,Open source communications platform for the AI age,"javascript, typescript, node, LLM, generative ai","communications, messaging, group chat, Team Collaboration, Chat platform",https://github.com/RocketChat,10
46, Fortran-lang ,https://summerofcode.withgoogle.com//programs/2023/organizations/fortran-lang,High-performance parallel programming language,"python, c++, fortran","compilers, programming languages, build systems, libraries, Fortran",https://fortran-lang.org,3
47, Liquid Galaxy project ,https://summerofcode.withgoogle.com//programs/2023/organizations/liquid-galaxy-project,We code immersive and interactive aps with G Earth,"linux, android, nodejs, flutter, Google Earth","visualization, artificial intelligence, networking, maps, ux",https://www.liquidgalaxy.eu,11
48, OWASP Foundation ,https://summerofcode.withgoogle.com//programs/2023/organizations/owasp-foundation,No more insecure software.,"python, javascript, java, ZAP, Juice Shop","web, cloud, application security, cybersecurity, DevSecOps",https://owasp.org,11
49, MetaBrainz Foundation Inc ,https://summerofcode.withgoogle.com//programs/2023/organizations/metabrainz-foundation-inc,"Open music / book metadata, music recommendations","python, machine learning, perl, postgres, spark","machine learning, open data, music, books, music social network",https://metabrainz.org,7
50, Society for Arts and Technology (SAT) ,https://summerofcode.withgoogle.com//programs/2023/organizations/society-for-arts-and-technology-sat,Create teleimmersive multisensorial experiences.,"python, javascript, opengl, c++, supercollider","web, graphics, cloud, multimedia, accessibility",https://sat.qc.ca,5
51, GNU Compiler Collection (GCC) ,https://summerofcode.withgoogle.com//programs/2023/organizations/gnu-compiler-collection-gcc,GNU compilers,"c/c++, gnu make, gnu autotools","compilers, developer tools, toolchain, openmp, link time optimization",https://gcc.gnu.org/,6
52, The ns-3 Network Simulator Project ,https://summerofcode.withgoogle.com//programs/2023/organizations/the-ns-3-network-simulator-project,ns-3 is a simulation tool for computer networks.,"python, django, c++","computer networking, network simulation",https://www.nsnam.org,3
53, LibreHealth ,https://summerofcode.withgoogle.com//programs/2023/organizations/librehealth,Healthcare for Humanity,"python, javascript, android, java, dart/flutter","web, deep learning, hfoss, radiology, mobile apps",https://librehealth.io,5
54, Python Software Foundation ,https://summerofcode.withgoogle.com//programs/2023/organizations/python-software-foundation,A programming language used for science & more,"python, javascript, c++, SBOM","security, visualization, compiler, modeling, Backup",https://python-gsoc.org/,22
55, freifunk ,https://summerofcode.withgoogle.com//programs/2023/organizations/freifunk,Free and open wireless networks,"c, python, javascript, openwrt, gnu/linux","embedded systems, open hardware, routing, wireless networks, federation",https://freifunk.net/en,6
56, MIT App Inventor ,https://summerofcode.withgoogle.com//programs/2023/organizations/mit-app-inventor,Anyone can build apps with global impact.,"javascript, java, gwt, swift","education, development tools, android, ios",http://appinventor.mit.edu,6
57, Swift ,https://summerofcode.withgoogle.com//programs/2023/organizations/swift,"Fast, safe, and expressive programming language","c++, cmake, swift","compilers, cross-platform, Packages, Server development, Standard Libraries",https://swift.org,3
58, NumFOCUS ,https://summerofcode.withgoogle.com//programs/2023/organizations/numfocus,NumFOCUS promotes open source scientific software.,"python, c++, r, julia","data science, graphics, scientific computing, numerical computation",https://numfocus.org,24
59, The Palisadoes Foundation ,https://summerofcode.withgoogle.com//programs/2023/organizations/the-palisadoes-foundation,Social media and member management for non-profits,"flutter, graphql, typescript, reactjs, MERN","web, api, database, ai, mobile",https://www.palisadoes.org,8
60, Drupal Association ,https://summerofcode.withgoogle.com//programs/2023/organizations/drupal-association,The best open source digital experience platform,"mysql, javascript, html, php, symfony","web, cloud, DXP, Massive community, Inclusive",https://drupal.org,4
61, LLVM Compiler Infrastructure ,https://summerofcode.withgoogle.com//programs/2023/organizations/llvm-compiler-infrastructure,LLVM Compiler Infrastructure,"llvm, c++, clang, mlir","compilers, development tools, libraries",http://www.llvm.org,20
62, Oppia Foundation ,https://summerofcode.withgoogle.com//programs/2023/organizations/oppia-foundation,"Free platform for interactive, tutor-like lessons","python, google app engine, angular, typescript, Apache Beam","education, web, ai, nonprofit, social impact",https://www.oppia.org,5
63, GCP Scanner ,https://summerofcode.withgoogle.com//programs/2023/organizations/gcp-scanner,Security scanning tool for Google Cloud,"python, google cloud","security, automation, scanning, google cloud",https://github.com/google/gcp_scanner/wiki/Google-Summer-of-Code-2023,3
64, Inkscape ,https://summerofcode.withgoogle.com//programs/2023/organizations/inkscape,Draw freely!,"python, c++, svg","web, graphics, design",https://inkscape.org,2
65, The Mifos Initiative ,https://summerofcode.withgoogle.com//programs/2023/organizations/the-mifos-initiative,End Poverty One Line of Code at a Time,"android, java, kotlin, spring, angular","artificial intelligence, cloud, fintech, financial inclusion, mobile banking",https://mifos.org,10
66, GitLab ,https://summerofcode.withgoogle.com//programs/2023/organizations/gitlab,Everyone can contribute,"javascript, ruby on rails, go, ruby, vue","cloud, devops",https://gitlab.com,3
67, QEMU ,https://summerofcode.withgoogle.com//programs/2023/organizations/qemu,Open source machine emulator and virtualizer,"c, python, linux, rust","systems programming, kernel, compiler, emulator, hypervisor",https://qemu.org/,6
68, Global Alliance for Genomics and Health ,https://summerofcode.withgoogle.com//programs/2023/organizations/global-alliance-for-genomics-and-health,We develop genomics tools to benefit human health,"python, postgresql, java, react, rust","web, genomics, bioinformatics, genetics, standards",https://ga4gh.org,7
69, Mantis ,https://summerofcode.withgoogle.com//programs/2023/organizations/mantis,Stream Processing for Operational Analytics,"java, Rxjava, Akka, Netty","cloud, distributed systems, Operational Analytics",https://netflix.github.io/mantis/,2
70, Sugar Labs ,https://summerofcode.withgoogle.com//programs/2023/organizations/sugar-labs,Learning software for children,"python, gtk, typescript, javascipt","education, games, desktop",https://sugarlabs.org,8
71, libssh ,https://summerofcode.withgoogle.com//programs/2023/organizations/libssh,The SSH library,"c, ci, ssh","security, cryptography",https://www.libssh.org/,2
72, GNU Octave ,https://summerofcode.withgoogle.com//programs/2023/organizations/gnu-octave,Free Your Numbers,"c++, hg","mathematics, scientific computing, numerical computation, numerical methods, matlab",https://www.octave.org,2
73, Learning Equality ,https://summerofcode.withgoogle.com//programs/2023/organizations/learning-equality,Building equity in education to transform lives,"python, javascript, django, vue.js","education, distributed databases, offline, learning",https://learningequality.org/,3
74, Open Genome Informatics ,https://summerofcode.withgoogle.com//programs/2023/organizations/open-genome-informatics,Open access genomics and bioinformatics projects,"python, react, r-project, graph, angular","genomics, bioinformatics, biology, data discovery",http://gmod.org/wiki/GSoC,1
75, GNOME Foundation ,https://summerofcode.withgoogle.com//programs/2023/organizations/gnome-foundation,A diverse and sustainable free software desktop.,"c, linux, rust, gtk, Flatpak","operating systems, desktop, graphics, open source, apps",https://gnome.org,9
76, UC OSPO ,https://summerofcode.withgoogle.com//programs/2023/organizations/uc-ospo,Amplifying Research Impact through Open Source,"python, c/c++, machine learning, verilog, VLSI","education, hardware, storage, AI/ML, I/O",https://ucsc-ospo.github.io/osre24/,14
77, Submitty ,https://summerofcode.withgoogle.com//programs/2023/organizations/submitty,Homework Autograding and Course Management Tools,"python, postgresql, javascript, c++, php","education, visualization, web, privacy/security, communication",https://submitty.org,3
78, TARDIS RT Collaboration ,https://summerofcode.withgoogle.com//programs/2023/organizations/tardis-rt-collaboration,Exploring supernovae made easy,"python, numba, numpy, jupyter, pandas","visualization, big data, simulation, astrophysics",https://tardis-sn.github.io,6
79, FreeCAD ,https://summerofcode.withgoogle.com//programs/2023/organizations/freecad,Cross-platform 3D parametric modeler,"python, c++, qt, OpenCASCADE, OpenInventor","engineering, graphics, cad, architecture, CAM",https://freecad.org,4
80, OpenWISP ,https://summerofcode.withgoogle.com//programs/2023/organizations/openwisp,The Hackable Network Management System,"python, javascript, django, lua, openwrt","networking, network management system, wifi, vpn, sdn",https://openwisp.org,1
81, Git ,https://summerofcode.withgoogle.com//programs/2023/organizations/git,"Fast,Scalable,Distributed revision control system","shell script, git, c language","version control, dvcs",https://git-scm.com/,2
82, R project for statistical computing ,https://summerofcode.withgoogle.com//programs/2023/organizations/r-project-for-statistical-computing,R software for statistical computing & graphics,"c, javascript, c++, r-project, fortran","visualization, machine learning, data science, graphics, statistics",https://www.r-project.org/,9
83, DBpedia ,https://summerofcode.withgoogle.com//programs/2023/organizations/dbpedia,Global and Unified Access to Knowledge Graphs.,"python, javascript, java, scala, rdf","semantic web, linked data, knowledge graph, data extraction, largelanguagemodel",https://www.dbpedia.org/,6
84, GNU Radio ,https://summerofcode.withgoogle.com//programs/2023/organizations/gnu-radio,The free & open software radio ecosystem,"python, c++, qt, simd","real-time, dsp, communications engineering, cybersecurity, Software-Defined Radio",https://www.gnuradio.org,1
85, X.Org Foundation ,https://summerofcode.withgoogle.com//programs/2023/organizations/xorg-foundation,"X Window System and related projects (Mesa, DRI, Wayland, etc.)","opengl, vulkan, x11, wayland, DRM","graphics, kernel, drivers",https://www.x.org,5
86, SQLancer ,https://summerofcode.withgoogle.com//programs/2023/organizations/sqlancer,Automatically testing database systems,"java, sql","fuzzing, Automated Testing, Logic bugs, Database systems",https://www.sqlancer.com,2
87, caMicroscope ,https://summerofcode.withgoogle.com//programs/2023/organizations/camicroscope,Toolkit for cancer imaging research,"python, javascript, mongodb, opencv, node","data visualization, image analysis, AI/ML, microscopy, dicom pathology",https://camicroscope.github.io,2
88, Django Software Foundation ,https://summerofcode.withgoogle.com//programs/2023/organizations/django-software-foundation-8o,Web framework for perfectionists with deadlines,"python, django","web, python",https://www.djangoproject.com,1
89, Kiwix ,https://summerofcode.withgoogle.com//programs/2023/organizations/kiwix,Internet content available offline.,"python, c++, nodejs, kotlin, vue.js","offline, browser, compression",https://www.kiwix.org,2
90, gprMax ,https://summerofcode.withgoogle.com//programs/2023/organizations/gprmax,Simulating electromagnetic wave propagation,"python, cuda, openmp, mpi, opencl","science, engineering, geophysics, electromagnetics, ground penetrating radar",https://www.gprmax.com,4
91, The NetBSD Foundation ,https://summerofcode.withgoogle.com//programs/2023/organizations/the-netbsd-foundation,Of course it runs NetBSD,"c, shell script, make, unix, bsd","kernel, packaging, userland, unix, bsd",https://www.NetBSD.org/,2
92, Creative Commons ,https://summerofcode.withgoogle.com//programs/2023/organizations/creative-commons,Nonprofit building a global digital commons.,"python, javascript, php, css, wordpress","web, nonprofit, copyleft, creative commons, legal",https://opensource.creativecommons.org/,1
93, TensorFlow ,https://summerofcode.withgoogle.com//programs/2023/organizations/tensorflow-d1,TensorFlow is a ML framework for everyone.,"machine learning, tensorflow, ai, Jax, keras","education, research, machine learning, on-device machine learning",https://www.tensorflow.org/,6
94, CloudCV ,https://summerofcode.withgoogle.com//programs/2023/organizations/cloudcv,Building platforms for reproducible AI Research,"python, django, docker, angularjs, aws","machine learning, artificial intelligence, computer vision, deep learning, AI/ML",https://cloudcv.org/,2
95, Synfig ,https://summerofcode.withgoogle.com//programs/2023/organizations/synfig,Open-source 2D animation software,"python, c++, gtk, gtkmm","2d/3d graphics, animation, vector graphics",https://synfig.org,2
96, XWiki ,https://summerofcode.withgoogle.com//programs/2023/organizations/xwiki,The Advanced Open Source Enterprise Wiki,"javascript, java, html5, css3, velocity","web development, wiki, platform, web applications, structured data",https://www.xwiki.org/,1
97, BRL-CAD ,https://summerofcode.withgoogle.com//programs/2023/organizations/brl-cad,3D CAD & other computer-aided tech (CAx),"python, c/c++, opengl, opencl, scripting","geometry, 2d/3d graphics, ray tracing, high-performance computing, deep neural net rendering",https://opencax.github.io/,5
